{
  "$schema": "https://json-schema.org/draft/2020-12/schema",
  "$id": "https://political-pathology-workbench.local/schemas/case.schema.json",
  "title": "Case",
  "type": "object",
  "required": ["caseId", "title", "subtype", "outcome", "outcomeClass", "publicationStatus", "reviewStatus", "sacredPoliticalOrderId", "sacredPoliticalOrderName", "sacredPoliticalOrderDefinition", "caseSelectionRole", "selectionRationale", "theoryTest", "unitClass", "caseType", "designStratum", "comparabilityGroup", "evaluationRole", "holdoutStatus", "samplingMetadata"],
  "properties": {
    "caseId": { "type": "string" },
    "title": { "type": "string" },
    "subtype": {
      "type": "string",
      "enum": ["regime", "war", "revolution", "movement", "collapse", "transition", "civil-religion", "empire", "postwar-order", "anti-sacrificial-movement", "hybrid", "imperial-revolutionary-state", "revolutionary-independence"]
    },
    "period": { "type": "string" },
    "outcome": { "$ref": "controlled-vocab.schema.json#/$defs/outcome" },
    "outcomeClass": { "$ref": "controlled-vocab.schema.json#/$defs/outcome" },
    "sacredPoliticalOrderId": { "type": "string" },
    "sacredPoliticalOrderName": { "type": "string" },
    "sacredPoliticalOrderDefinition": { "type": "string" },
    "legacyScaffold": {
      "type": "object",
      "description": "Explicitly non-analytical migration metadata preserved from pre-governed scaffold fields.",
      "properties": {
        "sacredPoliticalOrderStrength": {
          "type": "number",
          "minimum": 0,
          "maximum": 5
        },
        "sacredPoliticalOrderStrengthRationale": { "type": "string" },
        "analyticalUse": {
          "type": "string",
          "enum": ["prohibited"]
        },
        "migrationNote": { "type": "string" }
      },
      "required": ["analyticalUse", "migrationNote"],
      "additionalProperties": false
    },
    "caseSelectionRole": { "$ref": "controlled-vocab.schema.json#/$defs/caseSelectionRole" },
    "selectionRationale": { "type": "string" },
    "theoryTest": { "type": "string" },
    "unitClass": { "$ref": "controlled-vocab.schema.json#/$defs/unitClass" },
    "caseType": { "$ref": "controlled-vocab.schema.json#/$defs/caseType" },
    "designStratum": { "type": "string" },
    "comparabilityGroup": { "type": "string" },
    "evaluationRole": { "$ref": "controlled-vocab.schema.json#/$defs/evaluationRole" },
    "holdoutStatus": { "$ref": "controlled-vocab.schema.json#/$defs/holdoutStatus" },
    "holdoutProtocol": { "type": "string" },
    "samplingMetadata": {
      "type": "object",
      "required": ["targetPopulation", "inclusionCriteria", "exclusionCriteria"],
      "properties": {
        "targetPopulation": { "type": "string" },
        "inclusionCriteria": {
          "type": "array",
          "items": { "type": "string" }
        },
        "exclusionCriteria": {
          "type": "array",
          "items": { "type": "string" }
        }
      }
    },
    "goldCase": { "type": "boolean" },
    "publicationStatus": { "$ref": "controlled-vocab.schema.json#/$defs/publicationStatus" },
    "reviewStatus": { "$ref": "controlled-vocab.schema.json#/$defs/reviewStatus" },
    "audience": { "type": "string" },
    "theoryVersions": {
      "type": "array",
      "items": { "type": "string" }
    },
    "summary": { "type": "string" }
  }
}
