{
  "caseId": "north-korea",
  "title": "North Korea",
  "subtype": "regime",
  "period": "1948-present",
  "outcome": "stagnation-frozen-pathology",
  "outcomeClass": "stagnation-frozen-pathology",
  "goldCase": false,
  "publicationStatus": "draft",
  "reviewStatus": "draft",
  "audience": "researcher-review",
  "theoryVersions": [
    "general-theory-political-pathology-v1"
  ],
  "summary": "Draft balanced-case placeholder.",
  "sacredPoliticalOrderId": "north-korea-sacred-political-order",
  "sacredPoliticalOrderName": "North Korea sacred political order",
  "sacredPoliticalOrderDefinition": "Draft operational shorthand for the durable shared meanings, legitimacy claims, memory, obligation, and sacrifice logic associated with North Korea.",
  "caseSelectionRole": "stagnation-case",
  "selectionRationale": "Included to test frozen pathology and persistence without reform or collapse.",
  "theoryTest": "Tests whether an order can persist through repression, inertia, dependency, or managed dysfunction.",
  "unitClass": "political-formation",
  "caseType": "stagnation-case",
  "designStratum": "political-formation:regime",
  "comparabilityGroup": "political-formation:regime",
  "evaluationRole": "theory-development",
  "holdoutStatus": "not-held-out",
  "samplingMetadata": {
    "targetPopulation": "Political orders or historical episodes in which sacred-political-order strength, corrigibility, crisis pressure, and sacrifice can be evaluated from traceable evidence.",
    "inclusionCriteria": [
      "case can be represented as a political formation or bounded historical episode",
      "candidate evidence can connect sources, passages, claims, interpretations, and scores",
      "case contributes variation across outcomes, mechanisms, or negative controls"
    ],
    "exclusionCriteria": [
      "unit boundaries cannot be stated clearly",
      "sources are unavailable or rights-restricted beyond draft scaffolding",
      "case duplicates another unit without adding mechanism variation"
    ]
  },
  "legacyScaffold": {
    "sacredPoliticalOrderStrength": 5,
    "sacredPoliticalOrderStrengthRationale": "Provisional scaffold score based on the case outcome category; requires evidence-chain review before scholarly use.",
    "analyticalUse": "prohibited",
    "migrationNote": "Preserved from pre-Milestone 23 case-level scaffold metadata. Governed score records are the only canonical source for analytical scalar values."
  }
}
