{
  "caseId": "soviet-union-collapse",
  "title": "Soviet Union Collapse",
  "subtype": "collapse",
  "period": "1985-1991",
  "outcome": "collapse",
  "outcomeClass": "collapse",
  "goldCase": true,
  "publicationStatus": "draft",
  "reviewStatus": "draft",
  "audience": "researcher-review",
  "theoryVersions": [
    "general-theory-political-pathology-v1"
  ],
  "summary": "Draft gold-case placeholder for future traceability work.",
  "sacredPoliticalOrderId": "soviet-union-collapse-sacred-political-order",
  "sacredPoliticalOrderName": "Soviet Union Collapse sacred political order",
  "sacredPoliticalOrderDefinition": "Draft operational shorthand for the durable shared meanings, legitimacy claims, memory, obligation, and sacrifice logic associated with Soviet Union Collapse.",
  "caseSelectionRole": "gold-case",
  "selectionRationale": "Included as a reference case for fuller evidence-chain development and methodological calibration.",
  "theoryTest": "Tests the relationship among sacred-political-order strength, crisis pressure, corrigibility, and sacrifice.",
  "unitClass": "historical-episode",
  "caseType": "calibration-case",
  "designStratum": "historical-episode:breakdown-episode",
  "comparabilityGroup": "historical-episode:breakdown-episode",
  "evaluationRole": "theory-development",
  "holdoutStatus": "not-held-out",
  "samplingMetadata": {
    "targetPopulation": "Political orders or historical episodes in which sacred-political-order strength, corrigibility, crisis pressure, and sacrifice can be evaluated from traceable evidence.",
    "inclusionCriteria": [
      "case can be represented as a political formation or bounded historical episode",
      "candidate evidence can connect sources, passages, claims, interpretations, and scores",
      "case contributes variation across outcomes, mechanisms, or negative controls"
    ],
    "exclusionCriteria": [
      "unit boundaries cannot be stated clearly",
      "sources are unavailable or rights-restricted beyond draft scaffolding",
      "case duplicates another unit without adding mechanism variation"
    ]
  },
  "legacyScaffold": {
    "sacredPoliticalOrderStrength": 4,
    "sacredPoliticalOrderStrengthRationale": "Provisional scaffold score based on the case outcome category; requires evidence-chain review before scholarly use.",
    "analyticalUse": "prohibited",
    "migrationNote": "Preserved from pre-Milestone 23 case-level scaffold metadata. Governed score records are the only canonical source for analytical scalar values."
  }
}
